{
  "arbitration": {
    "applied_rules": [],
    "blocking_release_checks": [
      "required-reviewer-groups-present",
      "required-evidence-obligations-present",
      "runtime-convergence-not-failing"
    ],
    "evidence_merge_strategy": "union-evidence-classes",
    "primary_skill_order": [
      "control-plane-validation",
      "docs-truth-review"
    ],
    "reviewer_merge_strategy": "union-reviewers"
  },
  "canonical_inputs": [
    "docs/meta/knowledge/DECISION_RUNTIME_MODEL.md",
    "generated/knowledge/evidence-obligations.json",
    "generated/knowledge/review-decision.json",
    "generated/knowledge/reviewer-obligations.json",
    "generated/skills/mixed-diff-arbitration.json",
    "generated/skills/pack-registry.json",
    "generated/skills/skill-registry.json"
  ],
  "diff_range": "3aa40a42819d5108218c802b22346c63364317f9...HEAD",
  "generated_by": "tools/knowledge/build_read_first_packs.py",
  "ordered_packs": [
    {
      "pack_id": "pack-registry",
      "priority": "high",
      "reason": "required by control-plane-validation",
      "source_skill": "control-plane-validation"
    },
    {
      "pack_id": "runtime-convergence-report",
      "priority": "high",
      "reason": "required by control-plane-validation",
      "source_skill": "control-plane-validation"
    },
    {
      "pack_id": "read-first",
      "priority": "medium",
      "reason": "required by control-plane-validation",
      "source_skill": "control-plane-validation"
    }
  ],
  "pack_id": "read-first-packs",
  "priority_buckets": {
    "high_risk": [
      "pack-registry",
      "runtime-convergence-report"
    ],
    "low_risk": [],
    "medium_risk": [
      "read-first"
    ]
  },
  "schema_version": 1,
  "skip_packs": [
    {
      "pack_id": "command-registry",
      "reason": "not required by selected skills or arbitration rules for this diff"
    },
    {
      "pack_id": "evidence-sufficiency-map",
      "reason": "not required by selected skills or arbitration rules for this diff"
    },
    {
      "pack_id": "mixed-diff-arbitration",
      "reason": "not required by selected skills or arbitration rules for this diff"
    },
    {
      "pack_id": "scenario-packs",
      "reason": "not required by selected skills or arbitration rules for this diff"
    },
    {
      "pack_id": "skill-dependency-graph",
      "reason": "not required by selected skills or arbitration rules for this diff"
    },
    {
      "pack_id": "skill-registry",
      "reason": "not required by selected skills or arbitration rules for this diff"
    }
  ],
  "source_range": "3aa40a42819d5108218c802b22346c63364317f9...HEAD"
}
